{
  "scenario_id": "lawyer-council-missing-2026",
  "competence_date": "2026-10-01",
  "knowledge_at": "2026-10-01T17:28:37+00:00",
  "rule_bundle_id": "CONSUMPTION-PHASE4B-2026.10.01-3",
  "catalog_versions": {
    "services": "2026.09.17-1",
    "municipal_parameters": "2026.09.16-1",
    "public_annex_i": "rfb-41766-sandbox-1",
    "federal_obligations": "2026-sandbox-3",
    "federal_banking_calendar": "2026-national-febraban-1",
    "rtc_rates": "2026.09.25-1",
    "rtc_codes": "2026.10.01-3",
    "rtc_transition": "2026.10.01-2"
  },
  "facts": {
    "service.canonical_id": "CTRIBNAC_171401",
    "provider.municipality_ibge": "3550308",
    "customer.municipality_ibge": "3509502",
    "customer.person_type": "PJ",
    "operation.service_origin": "DOMESTIC",
    "provider.tax_regime": "LUCRO_REAL",
    "provider.person_type": "PRIVATE_LEGAL_ENTITY",
    "operation.amount": "1000.00",
    "federal.evaluate_withholdings": false,
    "rtc.evaluate": true,
    "rtc.operation_date": "2026-10-01",
    "rtc.operation_kind": "SERVICE",
    "rtc.buyer_relation": "B2B",
    "rtc.delivery_mode": "REMOTE",
    "rtc.consideration": "ONEROUS",
    "rtc.market": "DOMESTIC",
    "rtc.supplier_regime": "REGULAR",
    "rtc.supplier_id": "11111111000191",
    "rtc.supplier_country": "BR",
    "rtc.acquirer_id": "22222222000191",
    "rtc.recipient_id": "22222222000191",
    "rtc.acquirer_country": "BR",
    "rtc.recipient_country": "BR",
    "rtc.destination_basis": "ACQUIRER_DOMICILE",
    "rtc.destination_state": "SP",
    "rtc.destination_municipality_ibge": "3509502",
    "rtc.destination_evidence_id": "contract-establishment-1",
    "rtc.document_id": "dps-1",
    "rtc.gross_amount": "1000.00",
    "rtc.gross_currency": "BRL",
    "rtc.legacy_tax_inclusion": "EXCLUDED",
    "rtc.legacy_tax_evidence_id": "net-price-contract-line-1",
    "rtc.base_adjustments": [],
    "rtc.tax_treatment": "REDUCED_30",
    "rtc.collection_method": "SUPPLIER",
    "rtc.accessory_obligations_fulfilled": true,
    "rtc.credit_context": "OUTPUT",
    "service.ctribnac_code": "171401",
    "rtc.professional_category": "LAWYER",
    "rtc.treatment_rule_id": "RTC.TREATMENT.LC214.ART127-1",
    "rtc.treatment_evidence_id": "FIXTURE.ART127.ELIGIBILITY",
    "rtc.professional_council_supervised": true,
    "rtc.professional_council_evidence_id": null,
    "rtc.professional_structure_evidence_id": "FIXTURE.ART127.STRUCTURE",
    "rtc.professional_partners_qualified_and_supervised": true,
    "rtc.professional_has_legal_entity_partner": false,
    "rtc.professional_holds_legal_entity_participation": false,
    "rtc.professional_has_unrelated_activities": false,
    "rtc.professional_services_direct_by_partners": true
  }
}
